,Company,Date_Queried,Location,Platform,Search_Term,Text,Title,URL,Unnamed: 0
173,Purpose Financial,2020-07-30,"Spartanburg, SC",Indeed,Inclusion Technology,"Report Developer  Date: Jul 30, 2020 Location: Spartanburg, SC, US, 29306 Company: Purpose Financial Address : 135 N Church Street , Spartanburg , South Carolina , United States - 29306  Purpose Financial, Inc. is an innovative consumer financial services company that offers a diverse suite of credit products, promoting financial inclusion and meeting consumers wherever they are. Through its brands, the company is committed to helping customers achieve their version of financial stability in the moment and in the future. Since 1997, Purpose Financial has been a pioneer in the consumer credit and financial services market, with more than 5,000 employees in over 1,900 storefronts and offices across 28 states. At Purpose Financial we are always on the lookout for motivated individuals who share in our values of mutual respect to join our team of outstanding professionals. We offer: Competitive Wages Life/Health Benefits 401(k) Savings Plan Educational Assistance Paid Vacation/Holidays Employee Discounts Work-life Balance Business Casual Environment Paid Volunteer time off Rewards and Recognition Program EAP To learn more about Purpose Financial visit Purpose Financial Website  Provides documentation to the external auditing firm explaining why the chosen methodology is the best one, any disclosure determinations, and how to report and build-in controls. Support the month-end closing process as the Accounting department deems appropriate. Attend resource planning meetings with department representatives to prioritize development work. Attend whiteboard sessions and product rollout meetings to determine the economics of the product line. Discuss plans to reconcile daily using knowledge of existing procedures and practices. Present to the Accounting department new products or events and explain how the products will impact the department. Research why a chosen methodology is the best methodology, disclosure determinations, and report build in controls. Create and optimize new and existing complex reports Develop SQL queries to extract or calculate data based on reporting requirements Communicate and apply project standards to comply with rollout schedule. Identify, track, report, and resolve issues in a timely manner. Complete other duties as assigned. Adhere to all points of the creed. Utilizes and maintains a formal report writing process Understand, adhere to and enforce all corporate policies. All qualified applicants will receive consideration for employment without regard to race, color, religion, sex, sexual orientation, gender identity, national origin, or disability.Requisition ID: 8606 Nearest Major Market: SpartanburgNearest Secondary Market: South Carolina ",Report Developer,https://www.indeed.com/pagead/clk?mo=r&ad=-6NYlbfkN0DSwrzLV_d009t00Noqv8485ZIMmCq0NIXHKosxbhm15m5fUv9J0Ap-lQRszoI129DwOAr3xWq7F9fuS4wiouf_sFb8N97jfK0c0PxuIxBwYzNfuHuK8r9t09xFn9RJBXKVaIJVGQ3U89XztM-H_5HG_4G8EnGrWnoc-6FyRAY0wLVJ55TnMkQUnS3ocSGZ4NzOBhrqlX65Sh2Gbkcfj4O6wTn-loxmhUGPTEUVrw9VmZqWlq6Rj6qaq8o-2o8FhqPWXkcZ_PQ6PHn-pHXhMxMg0U2yN-G5DLlMEJJvGcV0O3Ah6XWENT9V7c7LJ_AYlJfsHoMWtTGDba39Ix1HtL4H1iVVf3L8DEHHB5lLHLLAkn8l0azfJYG3PerLvNuPW0s06wNNYNmA84lx0i2mmiVj0ylMxIZAOyigiHd5FoTaCxjklxHsQIJsShn3jx5mgPDg5Pd4FpT2Q6C_Se_z1vXs-UCOZIrSE13h9WaBsmwZOE_CMpQPvg9xwN_xG0ITPNKR8EecwaWl2i2R2P778zuwzpD4ouO-1rGmIkmcVYTgNg==&p=15&fvj=0&vjs=3,
174,Tacoma Public Utilities,2020-07-30,"Portland, OR",Indeed,Inclusion Technology,"*TO APPLY, PLEASE VISIT OUR CITY WEBSITE AT WWW.CITYOFTACOMA.ORG/JOBS. PLEASE NOTE THAT APPLICATIONS ARE ACCEPTED ONLINE ONLY AT OUR CITY WEBSITE.* Tacoma Power is currently hiring for Systems Power Dispatcher Candidate! Candidates are enrolled in Tacoma Power's Systems Power Dispatcher training program and must successfully pass the apprenticeship and obtain NERC certification for continued employment and appointment as a Systems Power Dispatcher. Systems Power Dispatcher Candidates work rotating shifts, e.g. 7 on, 3 off, 7 on, 4 off, 7 on, 3 off, etc. rotating between day, swing and grave each shift cycle. Systems Power Dispatcher Candidates learn and perform skilled work to insure the real-time safe, reliable and economic delivery of power to utility customers through the coordination and control of Tacoma Power generation, transmission and distribution electrical systems; maintaining system integrity and reliability during normal and emergency conditions by anticipating and responding appropriately to safeguard utility employees and the public through control of high voltage switching and electrical clearances; insuring operations meet NERC and WECC reliability standards; maintaining real-time balance between load and generation, appropriate frequency, interchange and operating reserves and by taking action to preserve the Interconnection up to and including manual load shedding. Ideal candidates can stay calm under pressure, make sound, quick decisions, can collaborate with a team but take charge when the situation warrants it. Additionally, we're looking for people who are self-motivated, detail oriented, adaptable, and resilient. Qualifications:  Graduation from high school or equivalent and: Successful completion of an electrical utility apprenticeship program OR Bachelor's Degree in STEM (Science, Technology, Engineering, Math) or related field. Four (4) years of System Operations, Utility Operations, Power Marketing, or direct supporting roles can be substituted for education on a year-for-year basis. OR Be a journey-level electrician working in an electrical utility system operating at 4 kV or above or military equivalent (Navy nuclear power, Army prime power, etc.) OR Three (3) years of experience in Power System Operations of an electric utility operating at 4 kV including but not limited to Power System Operator, Systems Power Dispatcher, Substation, or Generation Operator NERC Certification desired Knowledge & Skills:  Electrical theory as applied to electrical circuits and power systems All applicable laws, codes, regulations, safety rules, policies and procedures Location of streets, roads, and substations within utility service area Effective oral and written communication skills, including English grammar, spelling, punctuation and vocabulary Record keeping techniques using state of the art technologies Radio and telephone technique and etiquette Interpersonal skills, using tact, patience and courtesy Mathematics that includes algebra, geometry and trigonometry Learn the skills and tasks required of a Systems Power Dispatcher Understand and follow complex oral and written instructions in exact detail React quickly and efficiently in emergencies Learn the skills associated with operating a computer, electronic equipment and communication equipment Establish and maintain cooperative and effective working relationships with others Observe proper safety rules and precautions Operate a variety of tools, machinery, and equipment Effective teamwork skills Detail oriented with the ability to multi-task Selection Process & Supplemental Information:  This recruitment is being managed by Alissa McLain, if you would like to be notified of similar opportunities or stay connected with things going on at Tacoma Public Utilities and the City of Tacoma, connect with me on LinkedIn. City of Tacoma Commitment to Diversity and Inclusion Tacoma's diversity is its greatest asset. Tacoma embraces its multi-cultural and multi-ethnic character. Communities of color and immigrant communities are fundamental to Tacoma's entrepreneurial spirit, workforce, and long-term success. In Tacoma, equity and empowerment are top priorities, meaning that all Tacoma residents must have equitable opportunities to reach their full potential and share in the benefits of community progress. One of our goals is for the City of Tacoma workforce to reflect the community it serves. We actively work to eliminate racial and other disparities and welcome candidates with diverse backgrounds and/or multicultural skill sets and experiences. Our goal is for Tacoma to be an inclusive and equitable place to live, work, and play. Tacoma Power Tacoma Power is an almost 100% hydroelectric, municipally-owned public power utility, located in Tacoma. We serve approximately 170,000 customers as one of the three operating divisions of Tacoma Public Utilities, alongside Tacoma Water and Tacoma Rail. As one of the most livable, walkable cities in the country, you'll find that Tacoma is a great fit for all interests with places to bike, run, hike, and explore, the perks of a big city, and the charm of a small town. Job Type: Full-time Pay: $45.69 - $52.89 per hour Benefits: Dental Insurance Health Insurance Paid Time Off Retirement Plan Vision Insurance Schedule: Day shift Holidays Monday to Friday Night Shift Weekends Education: High school or equivalent (Required) Company's website: https://cityoftacoma.org/cms/one.aspx?pageId=14046 Work Remotely: No",Systems Power Dispatcher Candidate,https://www.indeed.com/pagead/clk?mo=r&ad=-6NYlbfkN0A9OlvJTvX2YddXUuw0E3xFhJjrsiHARgsjg7m0tgFDL9AC1jnLg0EjnY-vYVVJe3JB4nrYy4EF1-RKGj-DdIOMX0CYCwf2zWvG4yaKd10L1QVV1iWLzM4NiCUmtyOnzYy0dYzI5aFO0KBOz4OyeD4BTppWXv4K7Z-4zUZVLys4DjSMGb_ibcENe68jkPtcY8jLPraM_7QUdqI5oP-5SofAe192GqCeMAVBay7QKSMFsV0X23AjLhtu47qtkz7TOpOHSLp9DqV4ZdexLSzXiIH_3VLTNYD__Kc_1c5y_PMVXOoiiLbMhEum3ja4cy7GTPgVULUnyxoLo-UZmFyhnKKF17uqauR4i68Gh3XUiTzONfMoJyveYW0yQyBP1HzEv3BT3Agxrnby3UJ5g8GSGC7frb24Z-rRNxt4emDLXnNTEu4zrNAeVviTX1ZYR16LsJ2Mm3SIHDkOYUFw2fmYIGd4&p=16&fvj=1&vjs=3,
175,Keller Williams Realty,2020-07-30,"Danville, CA",Indeed,Ethics Technology,"KELLER WILLIAMS IS HIRING AND TRAINING MOTIVATED REAL ESTATE AGENTS! Keller Williams Danville is looking to hire and train motivated, licensed Realtors. If you are looking to build a career in real estate, or looking to take your existing career to the next level, there is no better place to start than the #1 Real Estate Brokerage in the country! At KW, You Can: Make a six-figure income Have a flexible schedule Work in an energetic, dynamic atmosphere Work independently OR join a team with other motivated agents Find the best free training and support (no previous experience necessary) Have top-of-the-line technology at your fingertips Receive ongoing coaching with expert mentors to exceed your goals QualificationsIn Order to Join Our Team, You Must: Have an active real estate license Have a desire to work independently and have control over your professional growth Have a strong work ethic and desire for success Have excellent communication skills and the ability to network to build your business As a Real Estate Agent, You Will Be: Networking using KW's proven systems, models, and technology platform Showing properties and working with home buyers Marketing properties and working with home sellers Keller Williams Danville is the perfect place for a fantastic career for talented individuals who are drive to help others find their perfect home! Job Types: Full-time, Part-time License: California Real Estate License (Required) Valid California Real Estate License (Required) Work Location: Multiple locations Benefits: Flexible schedule Professional development assistance",Licensed Real Estate Agent,https://www.indeed.com/pagead/clk?mo=r&ad=-6NYlbfkN0C4eIM5N5t3PERimQvVtVVW7fvdIC70ECyfjzDkqLjxrJ3EXncK5OqWpWPyFmZsXlv5BbvPHt9KH80VmNvc3m1YpWNZqSwR4rchAEwdQfiWa9wGorIUvsZAEOjFGgGydvdWCr1oZjn9hmk_ckDAZiQNUmIbxYFsE8_6qJ8l1e0Oh4xUVU4jLfZTcr3BLSAYflDY05ZGiBqvrnCvBmFkFGYbVslXggT9aULVBRAF0RlRWfXInatLtX5T3hVHl0T1jB6Jc6l9QWw_plXqxwoUPrqfNVM9QOAhBIbJrrZaBajlO1ZliRUccbpVIpOyGocsixDQNMawpUnWV83mWSTyM6nocPzUgZrIJl9a3Iz_WFJ2kCWf2PpfdYivkHvFO8W8SW1R1cxz9lXSfmos0h5S9P8FMlN-sdbdPpBnMg-KferL-3CyNfdo4rUslxhb6SBRSQYianLJhUi44w==&p=0&fvj=1&vjs=3,
176,Clutter,2020-07-30,"Berkeley, CA",Indeed,Ethics Technology,"Description Clutter is an on-demand, physical storage and moving, technology company based in Los Angeles that is disrupting the $50B/year self-storage and moving industries. We are hiring Part-time Warehouse Associates with positive attitudes and great work ethic that love to stay active! Load and unload Clutter trucks in a fast-paced warehouse setting Move, wrap, and palletize customer items Scan and organize customer items using our self-built mobile app Positive attitude and great work ethic! Weekend availability required Ability to lift up to 50 lbs and energy to move and lift throughout the day At least 18 years of age with high school diploma, GED or equivalent (any college experience is a plus!) Experience with at least one of the following preferred: moving, warehouse, manufacturing, inventory management, stocking, forklift, shipping and receiving, helper or general labor About Clutter Clutter picks up, stores and brings back your physical belongings at the click of a button. We are creating an innovative, on-demand physical storage platform; think Uber meets Public Storage. We’ve raised $300m from top investors including Google and Sequoia Capital. Clutter is headquartered in Los Angeles with operations in San Francisco, New York, New Jersey, Seattle, Chicago, and Southern California.",Warehouse Associate (Oakland),https://www.indeed.com/pagead/clk?mo=r&ad=-6NYlbfkN0DKngkBkrMhbo2Ht0wN8Pia7T-dloMpbuxFOEK52EqW2qNWQ3dusRPWO_YkFjzg0Wdo4UOghAidyOf-9BzCJkZrP_zEIYFBgL8CLVYJ1P2R2XKHvHlfmG6JmCXPvP_Pu2QPef_T9sInPsZ6hhC93Oa9f9O2uk07LrSi7f1AqVzRRUyFwD7sWQ8XnOYymH2REn15ijR_KxzFuod1COHhj6aag3WCgTAKczjegdTlnDAdfcxsL1ib8Lu_iRiNYUBToFOmlCdo-8KZYywXXEKKkaVErpnD_wpLTxTIuHNH31N6OVUr1ywwCLqvtkuZ8aj2AFLz05k_719FyZobi0GaWDXi5MBIPYqT6EVZV0bJ30elEcfbglrvAeCaLsaTKyp8s9MBtNvN_Jm8Pw_d-I4GRIKcXIftv7-5yCl4kYq8sKN4YKGKj7Kckxhn8m5j291cCqiqnQj6gTvToBnVh2Hq8m2K9D8FzFq2sRWaMX4s5vRKk8xmvD-3PNqNx-ZS5WyW0wdbcCA55P3FzGWZrm_W1aE93F5QIQkS8LTn-L0s_mDjyZxHdGNAIwMpmL9-1lvA1FznO_ajH7165TM10UQGmBl66UVGLgEMAypo70XIYimJQWVWZ4JsWhU1IV9Zhp809uOhtsUFB0QiBVstCq1nIr2qNTd7kVMIOxayYV0yPcC2GKYvyB37xfjNFws3iTrrc_zC0rcZuwgcfRIsvvdyUqhH181nMv150DjG4IhLx8bSihGdAj9XhEQcnmq649AVvg1JlyXuiAoRT0pIuIEa010VjmZBp2x8k71BipdderqlyAPe8DoQznonDH-wNmHRMUIBOrcsYUztyQgmkDAbTMKed-AxoJfFxbY7Az6VEM9yBRyh4s4Z7j4XhFb8WxnmwCSiJ7hm2BtfZ23c887Pxn4XQczuqszEph4Pvx5qoFvdEzgwkNrqic_Gigm3mv7jA_z1-Q4mpjYnoKS7IGGKsq_FWwHmInmIzsuG5eDC3XNkmfeSMX-UTEKtyF-tEwUdA5UM5d5mc1vRd7xZnwqrXjN2Q6SenhfAS5L2dMkM-eVeerf2e4kTszqW8dXx5Q10OQ57NZvHpqupsC98FuJhgoZSx8zf19U1vdOfVs0NYZJK6vkkcbpeAxd7JcdFbBmODw2F0o9XaJWw0Qbihj1Ag-Bw_Pd6_q1myw42kgu3AuSa2U2IuKQmERB5-dBqmkYhebE8FWj15ecTISW6xtoTSYzs&p=2&fvj=0&vjs=3,
177,FLIR Systems,2020-07-30,"Goleta, CA",Indeed,Ethics Technology,"Be visionary  At FLIR, we have a simple but ambitious mission: to develop market-leading thermal and sensing technologies which enhance everyday life. From saving energy, to saving lives FLIR is making a real difference in our world.Our products are used in a wide array of situations to rescue people in danger, detect criminals, conserve energy, navigate safely, provide security around the globe, and protect our environment.  We are looking for individuals who thrive on making an impact and want the excitement of being on a team that wins.  Job Description  Job Summary: Performs functions associated with FTIR measurement and analysis of FPAs in the backend process. Evaluates data to ensure compliance to thickness and taper specs for InSb products . Cross-training for etch and demount may be included. Performs set-up and calibration tasks on process equipment.  Primary Duties & Responsibilities: FPA (focal plane array) FTIR measurements of critical detector thicknesses, entering of data for WIP tracking, and data entry onto traveler. Cross-train in etch and demount as time permits Familiarity with operation of metrology equipment requiring analysis of data and extensive physical time on a computer. Maintain detailed records such as CAMSTAR & data entry into X Factory Maintain high-level of cleanliness in lab Understand clean room protocol and familiarity with handling chemicals. Schedule and coordinate WIP for efficient movement of wafers or FPAs Operate semiconductor equipment  Job Qualifications: Attention to detail is required to ensure proper documentation and maintenance of travelers and when operating semiconductor processing equipment. Communication Skills-Oral, Listening & Written required ensuring that procedures and methods are easy to understand and interpret. Listens attentively without interrupting and/or being distracted by other things Collaboration and Teamwork required to maintain open group communication and relationships, to refine processes and implement process improvement. Coping skills required to be able to stay focused, calm and cool with multiple demands and deadlines from superiors, subordinates and peers while maintaining focus on demanding deadlines and changing priorities. Flexibility is required having the ability to quickly adapt to changing requirements, special assignments and workload reprioritization. Initiative required displaying strong personal initiative and motivation to achieve desired performance results. Strong Organizational and Planning Skills are required to facilitate lab maintenance and resources.  Knowledge & Experience in the following required: Basic computer knowledge(Word and Excel desired) Wafer & IC handling Operation of metrology tools like FTIR Excellent manual dexterity and hand/eye coordination Chemical handling procedures clean-room protocol Lab safety  FLIR and all of our employees are committed to conducting business with the highest ethical standards. We require all employees to comply with all applicable laws, regulations, rules and regulatory orders. Our reputation for honesty, integrity and high ethics is as important to us as our reputation for making innovative sensing solutions.  FLIR is an equal opportunity employer.",Semiconductor Manufacturing Technician,https://www.indeed.com/pagead/clk?mo=r&ad=-6NYlbfkN0DHZx6muIrh-t8pI3uJlcx1o1BA1nGImWzpKA5zIAx_ynwZ_HsJv0NDxGoObEAtiHIGTrj5E142gkCh_F2_AZok78jbanXRqK4s-0kj76MuVh_B0kiw_pHBoPuH3wiOURAtg1kYUs_J3UsEkycrIPLUkjfyUEwP6xIdOtpGax6aYiCNxQ9jLFFg8OXhruLlBvj3sn_mu5-diriFWlFNcZPpj4ei_2Z7SeCXv389Er0TPct5o2IZWxK1dcl0ra_96ndg9XegZH3aw4hfi5DaxHigmLlr7A1eZTvBri1Erg2dstMgRHZPRKu7A9Vg_V09rz3YYKbVzaiA1n0CRIsdvWrw0JD8gz4wlrQxs2EmwblBNQwoCTX18QawSFveAMVW9vy6SnvHQhjRGd0CaTxbEjiO3J7OzH4juGM_xaTn_dkBjurzVRgJYJj7SwX1VzEkgdnQN6OZTcUsRK7HF8_a-DxiV3rSyI_nPv-O3kfBbfpqqP3oIoq7XwQHYtZ74r9n2cc=&p=4&fvj=0&vjs=3,
178,"G & C Multi-Services, LLC",2020-07-30,"Paducah, KY",Indeed,Ethics Technology,"G&C Multi-Services is looking for an experienced IT Specialist with the following qualifications: Associate's Degree and/or Equivalent Experience Working knowledge of relevant operating systems, software and programming Excellent problem-solving and critical thinking skills Keen attention to detail Strong organization skills, time management and prioritization Efficient troubleshooting abilities Effective communication skills, including speaking, writing and active listening Great customer service and interpersonal skills Strong work ethic Positive attitude and self-motivated Clean drug screen Reliable transportation. Job Duties Include: Review diagnostics and assess the functionality and efficiency of systems Implement security measures Monitor security certificates and company compliance of requirements Offer technical support to company staff and troubleshoot computer problems Install and update company software and hardware as needed Anticipate and report the cost of replacing or updating computer items Maintain and update company websites Create social media and advertising posts Manage online selling platforms Pay starts at $16/hour and we offer a competitive benefits package and potential for advancement. Full-Time M-F NO phone calls or drop-ins. Job Type: Full-time Pay: $16.00 - $20.00 per hour Benefits: 401(k) Matching Dental Insurance Health Insurance Paid Time Off Vision Insurance Schedule: Monday to Friday Company's website: www.gcmsnet.com Company's Facebook page: https://www.facebook.com/G-C-Multi-Services-llc-309440883977/ Benefit Conditions: Waiting period may apply Only full-time employees eligible Work Remotely: No",IT Specialist,https://www.indeed.com/pagead/clk?mo=r&ad=-6NYlbfkN0CQKhtuP4YMtIdQho3IMCQyHVTjzxFWzyDKHk_LYqnEaskbslfcgfoL0E0p82sg-LNVPiY6Xh6ZTOwVKzXaCB7m54D63tKI_qSw2Qgd6UPm-aqAqfuOhzYqqJq_gbZ858EJsxgBDvsw8-LljxV76mOjs1hnLlOvEmLD-Mv02bIhLZ8olCrBIszdALs8GUO9YbX-nkwRUSWubyeYxVuP8Wk76zAOWljEJqNRouo_STtr4NFCTwdhSyTiz5mHMYx6IN3_fHbwDdFVxQQKj-nCZgS1Fohqm_Q5wPg5FZSsQ_lEeF1gx400Fkrg0DMynJV6bpKnyn9tAyJAUo-TmkaTDijN0mgQx_K-NJULo-EhtwrcKy7Q8HCRiECO6aC50et0Zxqea1eumXth4wcvS5CkS6fcHDLSkQm_FXVn3WRyypb_1TxLT1cA-XXb&p=5&fvj=1&vjs=3,
179,Purpose Financial,2020-07-30,"Spartanburg, SC",Indeed,Ethics Technology,"Report Developer  Date: Jul 30, 2020 Location: Spartanburg, SC, US, 29306 Company: Purpose Financial Address : 135 N Church Street , Spartanburg , South Carolina , United States - 29306  Purpose Financial, Inc. is an innovative consumer financial services company that offers a diverse suite of credit products, promoting financial inclusion and meeting consumers wherever they are. Through its brands, the company is committed to helping customers achieve their version of financial stability in the moment and in the future. Since 1997, Purpose Financial has been a pioneer in the consumer credit and financial services market, with more than 5,000 employees in over 1,900 storefronts and offices across 28 states. At Purpose Financial we are always on the lookout for motivated individuals who share in our values of mutual respect to join our team of outstanding professionals. We offer: Competitive Wages Life/Health Benefits 401(k) Savings Plan Educational Assistance Paid Vacation/Holidays Employee Discounts Work-life Balance Business Casual Environment Paid Volunteer time off Rewards and Recognition Program EAP To learn more about Purpose Financial visit Purpose Financial Website  Provides documentation to the external auditing firm explaining why the chosen methodology is the best one, any disclosure determinations, and how to report and build-in controls. Support the month-end closing process as the Accounting department deems appropriate. Attend resource planning meetings with department representatives to prioritize development work. Attend whiteboard sessions and product rollout meetings to determine the economics of the product line. Discuss plans to reconcile daily using knowledge of existing procedures and practices. Present to the Accounting department new products or events and explain how the products will impact the department. Research why a chosen methodology is the best methodology, disclosure determinations, and report build in controls. Create and optimize new and existing complex reports Develop SQL queries to extract or calculate data based on reporting requirements Communicate and apply project standards to comply with rollout schedule. Identify, track, report, and resolve issues in a timely manner. Complete other duties as assigned. Adhere to all points of the creed. Utilizes and maintains a formal report writing process Understand, adhere to and enforce all corporate policies. All qualified applicants will receive consideration for employment without regard to race, color, religion, sex, sexual orientation, gender identity, national origin, or disability.Requisition ID: 8606 Nearest Major Market: SpartanburgNearest Secondary Market: South Carolina ",Report Developer,https://www.indeed.com/pagead/clk?mo=r&ad=-6NYlbfkN0DSwrzLV_d009t00Noqv8485ZIMmCq0NIXHKosxbhm15m5fUv9J0Ap-lQRszoI129DwOAr3xWq7F9fuS4wiouf_sFb8N97jfK0c0PxuIxBwYzNfuHuK8r9t09xFn9RJBXKVaIJVGQ3U89XztM-H_5HG_4G8EnGrWnoc-6FyRAY0wDvjIVKp-pwwrLTM08azmFnYe7tRzGlgXlVY237zN5vgjkLxRsFbLoS-DngebA4CLqM83OrPkRbuZiLJjwA3wTpItCMFAeAwOhoSevSyPACoN_wrNE_629KQqbuVT-frVo5xWBUOb3MgYlQPsE2WbLTmIxNu1KI2PZRFJ47chGIGCBtUw3DCBLbxcCWBBfqyPLP9V8o0TC3L0Fcd9tlmgscwNICp5LQb_a5EosfVgKNMmVYG7zWjymYy3xL7h99LSCVmd3ZBofpeT79gedVzS2Lv9Jm8HDvhQ2WqwaTbVjlgVLD79_gNEI4vMNMsD9rlMLSALv7qF1s-0zI3IwXN2s4ITkMiagvJcVaa7mMugTBb96u47K5ur6bfzhFV1VJ3rg==&p=7&fvj=0&vjs=3,
180,PG&E Corporation,2020-07-30,"San Francisco, CA",Indeed,Ethics Technology,,"Expert, Technology Programs Planning",https://www.indeed.com/pagead/clk?mo=r&ad=-6NYlbfkN0Dl5O3UwlcwwCSNUOo_pIXFXhqhPgZDNLRFp2hAbMlfu1d7JOPMxeGbJbd33LQjeimBnsw55fIwSNMNFkbXb8_1bQz9VWbdA4uZzt53Oc6S3ZPr8Rfgl-7Wdx_PsJ383HCqO7zmsAiNncuuypat6tL8Dyizo_O_W_I278gzCahwADjC9toRUStkMLBO4yzZRaXvLLPLSDzyN3fonv4SKn88_kn-3SewYaogYZ1NJiobHmLUYhfI2-DYzmRULG5KbNLaGI7XOyBPl36IEkVfMd3sFKsbWTfCmSOvEjvB0QoGaIgkCbuWnuHN-M-xXMA6Es0CZ9FYKiBTcmr9OVT_xQ7mwMMk1LCRiiDb5h3aIBtLP3HcV1GUcyTPh4g3LGOyfWcLnCemD2Dlfw==&p=9&fvj=0&vjs=3,
