,Company,Date_Queried,Location,Platform,Search_Term,Text,Title,URL,Unnamed: 0
115,"PLAYSTUDIOS, Inc.",2020-07-30,"Burlingame, CA",Indeed,Emerging Technology,"About PLAYSTUDIOS  PLAYSTUDIOS is the developer of award-winning casual games for mobile and social platforms, including POP! Slots, myVEGAS Slots, myVEGAS Blackjack, and my KONAMI Slots. The apps are powered by the company’s groundbreaking playAWARDS loyalty platform, which enables players to earn real-world rewards from more than 70 iconic hospitality, entertainment, and leisure brands across 15 countries and four continents. playAWARDS partners include MGM Resorts International, Wolfgang Puck, Norwegian Cruise Line, Resorts World, Gray Line Tours, and Hippodrome Casino, among others. Founded by a team of veteran gaming, hospitality, and technology entrepreneurs, PLAYSTUDIOS apps combine the best elements of popular social games with exciting casino gaming mechanics. To learn more about PLAYSTUDIOS, visit www.playstudios.com  SLOTS GAME DESIGNERDo you love games? Do you love to design games? Do you love working on creative teams with passionate, highly-motivated people? If yes, then we need you. At PLAYSTUDIOS, we make industry-leading social casino slot games for mobile and web platforms and we love our jobs. We embody an entrepreneurial spirit and are dedicated to making games our players love. We are looking for innovative new ideas. We believe in making everyone better, leveraging all our collective talents to make amazing gaming experiences. As a Slots Game Designer, you will lead the design process, collaborating with the rest of the team to make truly standout products that break the mold on what a slot game can be. Along the way, you’ll create unique payout experiences, that perfect harmony between math and emotion. We are looking for mature creatives who can give and take feedback constructively, and who can deliver business results. We are looking for visionaries who can be our design experts on existing and emerging game models and mechanics. The best games are still to be made and you can be the one who makes them.  Responsibilities Create mathematical models of slot machines Create or adapt game features; offer new ideas and conduct brainstorming sessions Tune and model complex systems using Excel Write copy, messaging and narrative elements of the game Create and maintain storyboards, wireframes, and design documents to communicate new features Work with software engineers to test and verify game math model simulations using statistical methods Analyze metrics and user feedback to derive insights and adjust game designs accordingly Remain up-to-date with casino game design trends Actively participate in the game development process, engaging the team and resolving issues Collaborate daily with your team, working together to solve problems and make great games  Requirements 2+ years of experience in casino game development, game, and math model design Extensive knowledge of real money or social casino games and player psychology Excel expert, experience with VBA preferred Programming experience; preferably C/C++, C#, Java, or VBA Skills with one or more art/wireframing tools helpful: Balsamiq Mockups, Photoshop, Illustrator Demonstrated ability to work in a creative and collaborative, interrupt-driven work environment Able to give and take constructive feedback in a professional manner Passion for gaming; avid gamer with a solid understanding of game development and game genres Strong understanding of game balance and game pacing Ability to multi-task and work on more than one game at a time Self-direction, drive, and leadership Bachelors Degree in Math, Statistics, Economy, Engineering, or Computer Science; or demonstrated expertise in combinatorics, probability, and statistics Benefits and Perks 100% health benefit coverage for you and your dependents! Performance-based bonuses. 401K plan and stock options. Flexible vacation policy. Employee-driven entertainment, happy hours, and team-building events. Catered lunches multiple times per week. Snacks and drinks available in the kitchen. Casual work environment. An open, collaborative workspace. Commuter benefits program. *** During COVID 19 we are currently working from home PLAYSTUDIOS is an equal opportunity employer. Applicants will be considered regardless of their sex (includes pregnancy, childbirth, breastfeeding, and related medical conditions), race, age, religion, color, national origin, ancestry, physical disability, mental disability, medical condition, genetic information, marital status, sexual orientation, gender, gender identity, gender expression, military or veteran status, or other protected category under the law.",Slot Designer,https://www.indeed.com/rc/clk?jk=b7b297dc096ba4d0&fccid=b322532af1872729&vjs=3,115.0
116,"Kimley-Horn and Associates, Inc.",2020-07-30,"Denver, CO",Indeed,Emerging Technology," At Kimley-Horn, one of the nation's premier planning and design consultants, our professionals are experts in many disciplines yet share one passion: making our clients successful. Looking for a terrific place to build your career? This is a unique role at Kimley-Horn to work with a team of highly talented visualization specialists and support firmwide infrastructure projects. Role: The candidate will be responsible for production and coordination of visualization services on projects, researching and implementing new and emerging technologies, and helping establish the overall vision and innovation strategy for real time design visualization capabilities. Position requires extensive multi-tasking daily, with the ability to self-manage tasks on multiple short- and long-term projects. Individuals must be articulate, attentive listeners, adept at client relations, and able to think outside the boundaries of traditional design. Position requires collaboration with marketing staff, project managers and other staff members to bring ideas to life. Qualifications Desired: Experience in the delivery of real time data capture and visualization services for the engineering industry Bachelor's Degree Experienced in PC-based platforms Proficiency in using UE4 Level design/Lighting/Environment artist Blueprints Materials/Shaders UMG design and functionality Asset Creation pipeline Proficient (or decent knowledge) in Speed Tree 8 Proficiency in the use of 3D applications (Autodesk 3ds Max) Texturing (UV mapping/texture and material consolidation) in 3DS Max Ability to understand plan and design documents and transpose them into 3D models Understanding of CADD applications (Autodesk AutoCAD & Revit, Bentley MicroStation) Ability to work closely with team members and on solo projects  Equal Opportunity Employer/Protected Veterans/Individuals with Disabilities The contractor will not discharge or in any other manner discriminate against employees or applicants because they have inquired about, discussed, or disclosed their own pay or the pay of another employee or applicant. However, employees who have access to the compensation information of other employees or applicants as a part of their essential job functions cannot disclose the pay of other employees or applicants to individuals who do not otherwise have access to compensation information, unless the disclosure is (a) in response to a formal complaint or charge, (b) in furtherance of an investigation, proceeding, hearing, or action, including an investigation conducted by the employer, or (c) consistent with the contractor’s legal duty to furnish information. 41 CFR 60-1.35(c)","Data Capture Technology Specialist (Denver, CO)",https://www.indeed.com/rc/clk?jk=75b72a187ba0b262&fccid=3f10b144cddd2446&vjs=3,116.0
117,Amazon.com Services LLC,2020-07-30,"Thompsons Station, TN",Indeed,Emerging Technology,"A bachelor’s degree from an accredited institution 5+ years of experience in designing, deploying/configuring and operating large scale wireless networks Expert knowledge of at least one vendor’s Wireless hardware - Access Points, Wireless Controllers and Wireless client Bridge In-depth knowledge of IEEE .11 standards including .11n and .11ac In-depth knowledge of wireless security - .1x, RADIUS, WPA2, EAP-TLS, PSK, general PKI concepts In-depth understanding of / internals In-depth knowledge of RF /Survey, RF Planning and Optimization .11ax (wifi-6) knowledge PPSK / Mesh / Outdoor wireless experience AWS networking and routing fundamentals CCIE Wireless Experience in designing and operating high-density AP and client deployments Experience in automating network administration using Perl, , or other languages A genuine passion for building networks that are simple and work well Understanding wired networking concepts (Routing and LAN switching) Excellent written and verbal communication skills Leadership skills and ability to influence and collaborate with other teams Experience working with vendors and prioritization of roadmaps/long term deliverables",Wireless OpsTech NetEng,https://www.indeed.com/pagead/clk?mo=r&ad=-6NYlbfkN0B2RbQeNRTK6UtcakMKsfYnOEzkKwr8nh4ZG-MYWMr-Y4N-zCgTJQiSbj1EbIG9E5jhxh1xPsr1EGviK7Vx6OxijQ_WgzvA5Dl-T7qPLq9mxmORzl1YD5BVZkiLmfWI2r0J8HcAHfIEpCO-tae9_QIM9vLbqx2m_dOe4JAjAxqnKPM8k9PpvWkhOB7l5Bo3Sc4PYOpFpecbHbafHPG3cOkGhsT_EpCpy7TxyFZ7EM9R1o2HSDV-r9u-LzIyfA6NHDbVer6P967sp1qLHnq05NZNLf5AfexQ97YC9mlDL-UYQz_T-HEeV4D6YWRz4HzCsBKwIMq1YpveFTIROPhytJmXJZTf6HWJ02wXJHVjeBt_bvxDL4zuu9HeHxx3BTUI_1JfC6GxasTwesmhlvz-_XJhp3vi1Ft11eO0fhdJ6dczzrM0g-C-txDlYE5GE4C5zGWi0iiPgHWg48HG7kQIAIAge5K-lHpy1jmW4Dpl1xNgjAe3YVGX0JRlwpt3dTpyIoIN6aoA9OzqtvISR1sAABjR&p=5&fvj=0&vjs=3,117.0
118,Edison Learning Group,2020-07-30,"Pittsburgh, PA",Indeed,Emerging Technology,"EdisonLearning is hiring a dynamic Sr. Director of Technology to join our team and be responsible for overseeing Global Professional Services, Global Support, and Digital Solution integration and delivery. This individual is a proven leader in creating a strategy, vision, and framework to assess customer problems, provide innovative solutions to, and ultimately deliver measurable results in a timely manner. A successful candidate is a strategic thinker who is willing to experiment and disrupt industry norms around the technologies employed to facilitate learning and to provide a seamless learning ecosystem. The Sr. Director of Technology is an expert in the technology used in fully online and blended learning and how to strategically employ these to create a fully integrated learning ecosystem. This individual will provide strategic technical advice and implementation support to groups across the organization to include the Curriculum Development team, Success team, and Senior Leadership. The Sr. Director of Technology will direct the technical work of third-party vendors to ensure products and services are delivered according to contracted quality and within timelines. The successful candidate will be seen as a trusted technical expert, across the organization, who fully understands current industry standards but is consistently evaluating newly emerging technologies for their potential application. This position will also be responsible for leading a world-class global professional services team comprised of implementation Consultants, Integration Specialists, Learning Management System Administrator, and Project Managers. The Sr. Director of Technology is a thought leader in best practices and typical use cases of K-12 clients, able to draw upon vision and experience to craft an onboarding experience that results in a high degree of client success. This position will create, monitor, and have responsibility for meeting success metrics and reporting performance to Senior Leadership. The Sr. Director of Technology is also responsible for global client support to include the operation of a best-in-class client helpdesk. This position will provide industry expertise and guidance to include metrics around average response times, resolution rates, and client satisfaction. The Sr. Director of Technology reports to the Chief Learning Officer and is a remote position. Key Responsibilities The Sr. Director of Technology plays a hands-on leadership role in the technical development and delivery of digital curriculum. This position is responsible for the total integrated learning ecosystem to include all SAAS applications, in-house programming, integrations. This position leads the Professional Services group to include new client onboarding implementations and ongoing support to existing clients. The Sr. Director of Technology provides technical expertise and oversight of the technical side of in-house digital curriculum development. This position evaluates new market trends and technologies to determines return on investment (ROI) and provides recommendations to the Leadership Team. The Executive Director of Professional Services and Digital sets and maintains divisional metrics and monitors against goals and targets. Understands and exemplifies world-class customer service to both internal and external customers and is ensures this is mirrored across professional services and customer support. Effectively operates within budget to manage the Professional Services, Client Support, and Digital Technology departments. Key Skills Professional Services and Support Deep understanding of common use case and trends in fully online and digital K-12 learning both domestically and internationally. Experience managing a global Professional Services and Support team and establishing departmental goals and metrics. Client-focused approach understanding how to successfully onboard new clients by building partner-level relationships. Ability to recruit, develop, and inspire team members to reflect the organization’s values and goals. Experience building a collaborative culture centered around personal accountability and service. Strong Project Management background and deep understanding of a broad range of project management methodologies. Digital Technology Experience in K-12 blended and fully online learning delivering technical curriculum solutions directly to students. Well-versed in common online and blended technical standards such as IMS and data specifications such as Caliper and XAPI. Thought leadership in the K-12 industry around best practices in digital curriculum development and delivery. Deep understanding of the full learning ecosystem and integration points between SAAS applications such as Student Information Systems and Learning Management Systems using Single Sign On, Batch vs Real-time integration, APIs (Rest vs SOAP), and LTI tools. Full software and product life-cycle project management with track record of delivering highly complex integrated solutions combined with creative energy to bring and cultivate fresh ideas into product development, delivery, and continuous improvement. Ability to transform vision into actionable requirements while understanding the ever-changing nature of the business. At least three (3) years leading an applications development team implementing digital curriculum and supporting integrations. Offshore development experience a plus. At least five (5) years leading a global Professional Services team. At least seven (7) years in both blended and fully online learning in a technical capacity. At least seven (7) years working with Higher Education and K-12 clients implementing digital curriculum and technical solutions. Expert understanding of digital technologies to include XAPI, SCORM, OneRoster, Common Cartridge, LTI, APIs (Rest and SOAP based), Learning Record Stores, and adaptive learning technologies. SAAS Application evaluation, selection, and management. Hands on experience with C#, .Net, Javascript, XML, HTML, and CSS. Excellent understanding and application of e-Learning development software such as Articulate Storyline and XAPI. Strong Project Management experience in both PMP and Scrum. CSM/PMP certifications are a plus.  Ability to communicate technical concepts clearly and effectively, with strong written and verbal communication skills.",Sr. Director of Technology,https://www.indeed.com/rc/clk?jk=8c590eb9887f0f6d&fccid=15aae71a928633c4&vjs=3,118.0
119,Amazon.com Services LLC,2020-07-30,"Springfield, TN",Indeed,Emerging Technology,"Bachelor’s degree from an accredited institution Excellent network design, implementation, and troubleshooting skills combined with a proven documentation methodology. 3+ years’ experience in designing and operating large-scale, production networks 3+ years of experience with major routing protocols, specifically BGP and OSPF 3+ years of experience with routing and switching hardware from major vendors including Juniper and Cisco In addition to providing top-tier management and support of Amazons vast network infrastructure, Network Engineers are expected to build or enhance tools, develop best practices, refine operational procedure and constantly think pro-actively and with innovation Ability to work on a diverse team with a diverse range of coworkers Experience in automating network administration using Python, Perl, or other scripting language Development and delivery of large scale network designs in data center networks Experience with IPv6 Design and implementations Excellent written and verbal communication skills Proficiency in wide area networking (including SDWAN), wireless networking, and industrial Ethernet Expertise in information security for industrial control systems A genuine passion for building systems that are simple and work well",Network Development Administrator,https://www.indeed.com/pagead/clk?mo=r&ad=-6NYlbfkN0B2RbQeNRTK6UtcakMKsfYnOEzkKwr8nh4ZG-MYWMr-Y4N-zCgTJQiSOBDXUpX504aKywZpkAKoGvLskz6JywcMn3nQ2oxGUSnail9lXYnmIqd7Y10hr1iesnNHwx2Ke4Z78--Py_jdK4bWPZpyIBvS2R7bCYetkzBeX5QRctkvayaFWkbcZydrp0i6zr_FDYdVDB1oE0v-hAXknTepjopIQ4dX-ZwUuo0XqYzQZRRvXIaWd1E2RyN2ZOlf4gRavqMw8gGZyBlyIAKl9rGmIWDT-P44ju-o3QmIfKhLrWZVRyO4RlaoMRPiVpjJPLDNTOtFTF9CkCl_Kk8s2vvpHXJH9h7q5Oe7wYmcVgDN631gUiQL4cKWsm64zYjNrT_EoCpA4Y6YNCetc3M1YwpXTl56rAdwxw6TL8VNooZbwyZUvoniwS2QSuU5nOHiFS7aWO-MnNFHDsiIinyi6vu7MbFq3BP6g1TIQnIeWx8x5-0QdgAtXLL6RwDgDVtWNRsWikfa1LaxXj9nVtr5VmQhl0hq&p=7&fvj=0&vjs=3,119.0
120,Georgetown University,2020-07-30,"Washington, DC",Indeed,Emerging Technology,,Data Research Analyst - Georgetown University Center for Security and Emerging Technology,https://www.indeed.com/rc/clk?jk=bba3783c0a4f83df&fccid=fb19e26fb0900ff5&vjs=3,120.0
121,Air Liquide,2020-07-30,"Fremont, CA",Indeed,Emerging Technology,"World leader in gases, technologies and services for Industry and Health, Air Liquide is present in 80 countries with approximately 66,000 employees and serves more than 3,6 million customers and patients. Oxygen, nitrogen and hydrogen have been at the core of the company’s activities since its creation in 1902. Air Liquide’s ambition is to be the leader in its industry, delivering long-term performance and acting responsibly. The science of electronics is transforming exponentially through innovation and connectivity around the planet. Every day, breakthroughs are making technologies – from micro-processors, memory chips and flat panels to photovoltaic cells – even smaller and more powerful, opening up countless new possibilities in how the world lives, works and connects. Air Liquide Advanced Materials grows by enabling our customers to innovate. Our ALOHA™ and Voltaix® products are critical to the manufacturer of the newest computer chips required for Big Data and the Internet of Things. Candidate must have valid employment authorization in the U.S. and must not require visa sponsorship now or in the future. This position is not open for non-immigrant visa sponsorship. Located in Fremont, CA The role of US Zone Technology Program Manager within the Technology Program Management team of Air Liquide Advanced Material, a leading supplier of Chemical Vapor Deposition (CVD) and Atomic Layer Deposition (ALD) products for the semiconductor industry, requires the candidate to develop and manage the new products engagements with US-based development partners in the field (end users, equipment companies, academia).The mission consists in being the team’s primary point of contact for the partners, and manager of the information flow between AL and them. Thanks to a strong technical background in precursor chemistry and application, the selected candidate will understand the customer’s roadmap and needs and will be able to promote new molecules form the Air Liquide portfolio and usage for new processes. The selected candidate will compile technical information coming from various internal sources (chemistry & application development) and present such documents to industry players, gather and communicate back feedback, and manage the supply chain and logistics of evaluation samples to such partners in the US and overseas. Additional responsibilities include the scheduling and tracking of action items of joint development programs and the contribution to troubleshooting task forces when necessary. The position is based in Fremont, CA. Responsibilities include but are not limited to: Establishing and Managing Technology Engagement with key US customers, either being thin film deposition equipment companies, Tier-1 end users or start-ups/academia, focusing on emerging ALD/CVD applications. Responsible for inserting our molecules in customers’ roadmaps through an in-depth product introduction strategy. Acting as key technology and marketing representative, internal and external, for ALAM’s technology offering. Preparing, updating and managing a library of Technical documents related to CVD/ALD materials and applications for the internal technical community and customers. Organizing and overseeing the supply of new products to R&D partners globally (generation of quotations and proposals, SDS generation and reviews, order fulfillment and delivery tracking, management of a vessel fleet for R&D products, etc.), Supporting the dissemination of qualified R&D products to other countries by actively and clearly sharing data and information with colleagues based in other regions. Being the point of contact for contractual discussion and leading the project together with management and IP Dpt until its closure. Support the actions and development of a Junior member Develop and utilize depth of knowledge of products to assist customers in product handling issues, technical support, and new product opportunities. Successfully complete all assigned training. Ability to travel domestically (&gt;35%) and internationally as needed (&gt;25%)  PhD degree in chemistry or semiconductor processing/engineering 5+ years experience related to Chemical Vapor Deposition or Atomic Layer Deposition products and/or processes in the field of semiconductor. Deep understanding of the semiconductor ecosystem (OEMs, customers, technology providers, key academia) Good commercial and negotiation skills, P&L understanding. High knowledge level in at least one item amongCVD/ALD precursors synthesis, purification and metrology techniques: FT-IR, XDR, ICPMS, NMR, TGA. film deposition techniques, characterization, and process integration for Logic, DRAM, or 3DNAND “Doer” mindset, Ability to troubleshoot and deep dive into technical issues as needed Able to lead by influence in a complex, multicultural, organization. Must possess the ability to coordinate multiple tasks in parallel and operate within tight schedules. Good oral and written communication skills Multi-level and multi-cultural interaction skills internally and externallyExperience with contractual documents (NDA, JDA, etc), their negotiation and closure.",Technology Program Manager,https://www.indeed.com/rc/clk?jk=bdd15eccf91248e2&fccid=0bfc42f123844c30&vjs=3,121.0
