,Company,Date_Queried,Location,Platform,Search_Term,Text,Title,URL,Unnamed: 0
0,3 Day Blinds - Sales Operations,2020-07-30,"Antioch, CA",Indeed,Trust Technology,"Over the course of our 40 year history, 3 Day Blinds has become the leading national retailer and manufacturer of quality custom made blinds, shades and shutters. We help transform our client's homes and work places by offering a wide variety of products that add beauty and comfort to every space. WHAT'S IN IT FOR YOU As a Design Consultant with 3 Day Blinds, you can join our growing sales team with confidence! We offer a generous uncapped compensation plan and bi-weekly draw while you ramp up your expertise. You will be provided with quality company generated leads, and are greatly rewarded for self-generated leads as part of our lucrative monthly bonus plan You'll receive 4-weeks of paid, world class training and be provided with state of the art tools, including a laptop, smartphone, product samples, and other resources necessary for your success - at no cost to you We offer a competitive benefits package including Medical, Dental, Vision, and a 401(k) with a company match. We also provide mileage reimbursement. We are looking for ambitious and driven individuals to join our growing team. We operate in a high-performance, dynamic culture and our work atmosphere is entrepreneurial. If this sounds like it could be you, read on! HOW YOU'LL CONTRIBUTE Expertly match our products and services to client's needs Successfully close appointments by demonstrating our unique Value Proposition, and by building trust and credibility Properly execute all systems and procedures to ensure client satisfaction, and to avoid order errors that adversely affect the company's bottom line and positive reputation Measure, record, and configure specifications accurately and efficiently Provide high- level client service and follow up in a friendly, professional and timely manner for both internal and external clients Be flexible to the needs of the business, including appointment scheduling, time off requests, attending team meetings and training Live our Core Values of Integrity, One Team, Excellence, Superior Client Experience and Passion, to Delight our Customers Understand and execute Company operating policies and procedures as outlined in Team Handbook and other related communications ATTRIBUTES FOR SUCCESS Critical thinking and problem solving skills Quick learner who is adaptable, self-reliant, resourceful and handles competing priorities Understands and carries out oral and written instructions, and requests clarification when needed Expresses thoughts, ideas, concerns in a positive, respectful and productive manner Works independently, but also functions well as part of a team REQUIRED High school degree or equivalent is required. Some college work is preferred Availability to work full-time five days per week, one being a weekend day Proficiency with using a PC and with Microsoft Windows based programs Ability to quickly learn and follow new technology processes and system Can drive within canvassing areas and also accommodate longer drive times to meet the needs of clients outside of assigned area Reliable transportation, a valid driver's license and proof of insurance Can lift & carry up to 35 pounds PREFERRED 2-5 years relationship selling experience within either: In- home or outside sales, preferably in specialty or custom product/services Retail environment – ideally in like field such as Home Décor/Furnishings Education or experience in Design and Decor Experience with POS Systems #IND123 ",Design Sales Representative,https://www.indeed.com/pagead/clk?mo=r&ad=-6NYlbfkN0DdoBBqUtgGQxm9m0w-K6mDq7ruzpD3Yu8AKXLjE9T6PiUqvJaz9_a7NcIJL09qVSui32fEVEQEhRuA-69aIVat5sbqKtlfVoaCatWwWIo5lQRB1uY-yAzA2PLUVLBmGuGLf2KamS6YJATmxIsjvxe8ldJo-GWd_E5fN5RNO5pP4h6aVQpUxCQ91_prQjIJo0WAzLztrtscB7cCxNZiFV6mgExGTWI8qch31imRqryqgZPnyl6xZKlUNEe9EYLiLBsyIYUXT532_tEb9RdkH2V19rh_petr9ImUEEm8LK-UlZzM34ahhmd1MxC4iqLm0JNVo5UAnioS2Dampqep85tzl2WhjK8aYKbqWz5stuYgkcHQfMnDuP0hu1AkbnejgCzz_64eRVKVWEvQGpKD78Wj&p=0&fvj=0&vjs=3,0.0
1,Bandwagon,2020-07-30,"Greenville, SC",Indeed,Trust Technology," We are an identity infrastructure company that helps companies transparently aggregate, manage, and store valuable consumer identity information with a singular focus on creating better experiences with products and services. Bandwagon was started in 2015 and is headquartered in Greenville, South Carolina. We believe that transparency can be increased without losing trust and that is why we have created the Glassbox Technology™ philosophy. This approach differs greatly from age-old beliefs that marry obscurity with security. Bandwagon believes in allowing consumers to share the information that they want to share enabling companies to curate better products and services tailored to the preferences of their customers. We are venture-backed with products in market and we are generating revenue. Like most successful startups, the key to success early on is the ability to stay alive. Some call it luck. Some call it determination. Some call it grit. We believe that it's a little bit of each of those things and A LOT of support from our friends, families, advisors, investors, and early team members. We exist because a lot of people worked to make sure that we do. Someone like you! Diversity in experience and thought are major components of what we believe keeps a team fresh, inclusive, innovative, and dynamic. We are looking for team members that have passion, tenacity, and are inquisitive among other great characteristics. We believe in the power of our people. When it comes to capital and resources, we understand that we will only go as far as our team can take us. For us, making the right investments in our team members means greater, more intuitive solutions for our partners and a business that we are proud to invite new members into. If you would consider yourself ""curious"" about technology, data, blockchain, identity infrastructure systems, or trust dynamics, we would love to talk to you! Responsibilities will include full-stack development and maintenance of production web services and browser-based web applications in a fast-paced startup atmosphere. Flexibility and eagerness to learn new technologies a must. The position further requires a one-quarter share of 24-hour on-call time to handle off-hour service disruptions. The position will be based in our Greenville, SC office. Bachelor's degree in CS or a related field or 3-years of industry experience (Code School graduates are also welcome to apply!) Experience with Javascript Startup mentality: self-starter, proactive, flexible, team-oriented The ability to prioritize and multitask in a scrappy, entrepreneurial environment Competitive salary + stock options Unlimited vacation Flexibility to explore ""passion & pride"" projects Paid professional development Aura (https://www.experienceaura.io/) - a fan-identity and attendee analytics platform for live-event organizers (sports teams, festivals, etc.) IdealSeat (https://idealseat.com/) - a simple and secure white-label ticketing solution for creators, artists, and non-traditional event organizers ",Software Engineer,https://www.indeed.com/pagead/clk?mo=r&ad=-6NYlbfkN0Aa_LJJBwmlrKIIt_FO839fKVQG1jq8tJQJYE8hHiJ_TAvfld3H7NnsfwYV_Wf2hMs7yI5-U4vkzz5RNj7woVcToH0uSoHlauFrMa051EQH6WRA5Uq8gfYc55lcBwn-4jpQyX4_MRMWLDMSZp4DB4rER-Xe4xk7KpH2S2poPlGP_kBezAh6lGUV5pxbZuQNd1O5mrUUNl9vNJkavFcicAXgXeet7fSj0lM1v6nSexzG4BoOYUGNek7a53VfoTI2YXIcdsWMsJERNYnRKK8dg8-Irfj0sMJwAjo-dKHcUddFyTizAu_rPtDjCwi_CaHipD-F8wrG9BJ8FkQu9cLm2CEk36zzBW7-3QKmd9L2TvWxqPJZo9m-CASS314I1m3h6qzyjGD7znPfp7LvvbGO5zJl0pYlbPBZ5CJ6KInnzcoed6_nzsgx6R-K91O3z6EFNgv4SUjUtt_cwuzDxTQHhMXymLNVmeLjCBg=&p=1&fvj=0&vjs=3,1.0
2,YWCA of San Gabriel Valley,2020-07-30,"Covina, CA",Indeed,Trust Technology,"DIRECTOR OF OPERATIONS The YWCA of San Gabriel Valley (YWCA-SGV), a social change organization in Los Angeles County, is seeking a Director of Operations to join our executive leadership team. A successful candidate must model our motto of excellence with heart, and align with our organizational values of impact, inclusion, compassion, high bar, and humility; while embracing our mission to eliminate racism, empower women and promote peace, justice, dignity, and freedom for all. The Director of Operations will be responsible for overseeing administration and program operations throughout the YWCA-SGV to assure accountability and success; and to use effective internal management systems and controls throughout the organization. To manage and cultivate a senior management team that is dedicated to administrative and program excellence, capacity building, training, and building relationships with internal and external stakeholders. The Director of Operations’ primary responsibility will be to ensure that program operations, human resources, information technology, finance, and administrative functions all run effectively and efficiently. The Director of Operations will provide leadership oversight and coaching to these operational areas. Additionally, the Director of Operations will interface as appropriate with the Board of Directors in providing operational updates, new initiatives, and sustainability initiatives. Successful candidates must have a Bachelor's degree in operations and/or business management (or a related field) and have prior experience in a management or leadership position. A deep understanding of human resources, finance and nonprofit operations, including grants and contract management oversight is essential. PROGRAM SERVICES AND OPERATIONAL RESPONSIBILITIES:  Provide leadership direction to designated senior managers to assure successful completion of program contract requirements, human resources needs and budgets. Assess and improve, as needed, program operations work processes, tools and metrics. Define senior team performance metrics and measurement criteria to evaluate performance in accordance with the defined statement of work. Oversee Information Technology systems and services, provided internally and by external consultants. In partnership with Executive leadership, direct the development and preparation of short-term and long-range plans/budgets based on portfolio of grants and contracts; and fundraising goals. Provide financial forecasts for operating and capital planning and budgeting. Oversee the maintenance of a safe, clean working environment that meets COVID-19 and other regulatory requirements. Oversees the establishment, maintenance and monitoring of internal controls, as well as policies and procedures for all operations of responsibility. Read, interpret, review, and comply with all federal and state legislation pertaining to operations in areas of responsibility. Serve as organization-wide leader on real property (e.g., lease management and facilities management); technology services; risk management; security management; energy management; insurance and property management. Review and approve all contracts and contractual amendments within areas of responsibility. Work with leadership and staff to promote diversity, equity, and inclusion. Identify and monitor opportunities for training and education development. Oversee a welcoming and seamless onboarding and orientation for all new employees. LEADERSHIP, QUALITY IMPROVEMENT AND COACHING RESPONSIBILITIES Supervise direct report senior managers who will include the Director of Programs, Director of Finance, Human Resources Manager and others as designated. Supervision and management will include, collaborating, team-building, evaluating hiring, disciplining, discharging and documenting actions taken. Develop and implement quality measurement and evaluation of services in all areas of responsibility. Set employee performance expectations, and provide feedback and evaluation of outcomes for areas of responsibility in a regular systematic manner. Motivate, lead, and inspire the team to quickly resolve challenges. Coach and provide training to designated managers to strengthen accountability and leadership skills. Develop a culture of continuous quality improvement throughout all levels of the organization. Report operations’ results in a timely manner, monthly, quarterly and annually to support improvements where necessary. Support and understand nonprofit finance and budgeting, including profit and loss, balance sheet and cash-flow management. Oversee leadership workgroups with the Directors of Programs and Finance on monitoring all programmatic goals and outcomes, including contract and budgetary requirements. Support the organization’s audit and tax filing processes. Update management and leadership on any emerging issues and risks. EXECUTIVE LEADERSHIP RESPONSIBILITIES Partner with the CEO and Board of Directors in executing the development of long-range strategic plans for all areas of responsibility and an overall corporate strategic plan. Staff Finance, Human Resources Committees, Board of Directors meetings and other designated Ad Hoc workgroups, including preparing and presenting reports as required. Identify and address weaknesses, strength and growth opportunities for the organization. Build and cultivate relationships and partnerships with key stakeholders, including banks, donors, insurance bookers, policy makers and others to support, build capacity and sustain the YWCA-SGV. Perform all other duties as assigned. WHAT WE ARE LOOKING FOR IN THIS POSITION?  To be successful in this job, you will demonstrate the judgment, work, and wisdom of an executive leader who embodies a commitment to diversity, equity and inclusion. Fundamentally, we want someone who can make things happen, directly and through others; and who has the skills and experience to do that in our work environment. We want someone that has experience in shaping and/or transforming organizational culture to meet the demands of the present and the future. Fast-paced and detail-oriented skills, bringing a passion for making things work well and an ability to handle assignments effectively in a high performing environment, including strategically prioritizing the most important projects while keeping the others on track as well. Solutions-oriented, flexible, and systems-minded, with the ability to adapt to the evolving needs of our growing organization and to think three (or 30) steps ahead to ensure things run smoothly. You will bring demonstrated successes in previous work and awareness of where you need to grow. You have the ability to work effectively with a talented and racially diverse team, and to proactively spot issues of equity, bias and inclusion across multiple identities and bring practical solutions. A very strong critical thinker and problem solver, with senior perspective and strong interpersonal skills, and excellent communication skills in writing and in-person. Strong relationship-building, quickly gaining trust, especially across lines of difference. You’re able to build strong rapport through being true to your word, warmth, humility, optimism, humor, etc. The ability to build consensus and relationships among managers, partners and employees. Bachelor’s degree in management, business or related field. Masters’ in Business, Public Administration and/or similar degree preferred. Experience in nonprofit management, operations, and leadership. Strong experience in Human Resources and Workforce Development. Understanding of nonprofit grants and contracts, and financial management. Demonstrate strong analytical and problem-solving skills. Competence using:  Microsoft Word, Excel, PowerPoint, Outlook, database software, and finance and payroll systems. A valid California driver’s license, reliable automobile, including insurance as required by California law, and an operable mobile phone are required at all times while working for YWCA-SGV. Job Type: Full-time Benefits: Dental Insurance Employee Assistance Program Health Insurance Life Insurance Paid Time Off Retirement Plan Vision Insurance Schedule: Monday to Friday Weekends Experience: Management: 4 years (Required) Education: Bachelor's (Required) License: Driver's License (Required) Language: English/Spanish (Preferred) Company's website: WWW.YWCASGV.ORG Benefit Conditions: Waiting period may apply Work Remotely: No",Director of Operations,https://www.indeed.com/pagead/clk?mo=r&ad=-6NYlbfkN0Apxgwsp9ytGBD6387qbiEvF3vAxJlPzRmYkEjOHtAq7SMpu6B9MJro4K4kRjyb_vwGHG93Li6p1JNNg-Uqi1LqduFo0F8x4WDrfCBEa3DIz-BFhgIMBTpLyCi5oFqHzUV5w9PSj-9aTRGh5W3KXR7kModdcLvOhXo2jCGip22ZvnNIjnsglhLTfZXGgh-MyZa7majwsbx9d9Oo2FqkbsZyQYWLv0m7VVDNKu-Opq4u6sb38GJtShaWXLwSnjZ-u1uWAWmVNVBhRQ58FXfh5gQBRcyIV906rM__MziW_pifVGHQ1uCIshPOTdFXRepxSeo84GdgTmYYNKQ_oYHLLjtbYQbbiUcKpoq33HI_uFofjHFgN-1-t5REX_RsK9SAlhxr9XZd4Nr4IS1fv3HzE3-pnmOLM3dKOnVuEwPASUCpO4n5nAEiotFCn7qymQK7ilqUvYUjHS1QTw==&p=2&fvj=1&vjs=3,2.0
3,Vector Talent Resources,2020-07-30,"Washington, DC",Indeed,Trust Technology,"VECTOR TALENT RESOURCES Title: Windows System AdministratorJob#: 20-00126Pay Rate: 1099 or W2 Hourly or Salary 85000.00 - 90000.00, with benefits, PTO, Holiday Pay etc. Certifications Required: Microsoft Certifications MCSA 2012 and MCSA Cloud Platform are required and VMware Certified Associate for VMware v6 is required Start Date: August /2020Work Permit: US Citizen / Green Card with Public Trust Level 2 ClearanceShift information: 7:30am - 5:30pm Monday (8 hours per day; can work hours between these standard business hours. Position Type: Government ContractorLocation: Washington, DC Job Description Overview:  Vectors Client in Washington, DC is seeking a Windows Systems Engineer for an immediate assignment! Windows Systems Engineer - Job Description Must hold active Public Trust Level 2 clearance Functions commonly performed:  Some on-call responsibility for emergency situations may be required Administer Microsoft Windows Server Update Services (WSUS) Administer Office 365 and other Microsoft Azure Cloud assets Administer CyberArk Enterprise Password Vault server Administer McAfee ePolicy Orchestrator server Troubleshoot and perform break fix including emergency after hours onsite support Install and configure hardware Plan, design and implement software services and upgrade OS Manage and configure Active Directory (AD) Attributes, LDAP Queries, PowerShell Scripting to Modify AD Attributes, Group Policy Analysis, GPO Configuration & Item-Level Targeting, Workstation Configurations, Browser Configuration Settings, working with System Owners to integrate applications with Active Directory Perform operating system and VMware administration, account management and provisioning activity Analyze cyber security vulnerability scan reports and apply vendor patches including but not limited to WSUS Perform changes as required and respond to outage resolution requests promptly Maintain storage subsystems Support evolving Cyber Security initiatives and on-demand rollouts. Provide support to IT Vendor Manager to perform asset management activities Knowledge/skills:  Bachelors Degree in Computer Science / Engineering 8 years' experience designing and managing multiple Active Directory Forests and Domains for a large, geographically dispersed enterprise (1,000 users) 8 years' experience administering DNS. WINS, and DHCP 8 years' experience configuring Group Policy Objects to secure a Windows infrastructure 5 years' experience with complex scripting leveraging PowerShell 5 years' experience working at an AD 2008 functional level and migration to 2012 functional level 5 years' experience with implementing and maintaining the PKI Infrastructures, server certificates, Certificate Authority, Secure DNS (DNS SEC) 3 years' experience administering Azure Cloud 3 years' experience administering VMware and vSphere environment is required Experience with domain consolidations / migrations 3 years' experience with Microsoft Windows Server Update Services (WSUS) Other Qualifications:  Microsoft Certifications MCSA 2012 and MCSA Cloud Platform are required Microsoft Certifications MCSA 2016 and MCSE Cloud Platform (Azure Admin) are preferred VMware Certified Associate for VMware v6 is required VMware Certified Professional for VMware v6 is preferred Experience with CyberArk Enterprise Password Vault, Infoblox and SolarWinds is a plus Vector Talent Resources is an Equal Opportunity/Affirmative Action employer. All qualified candidates will receive consideration for employment without regard to disability, protected veteran status, race, color, religious creed, national origin, citizenship, marital status, sex, sexual orientation/gender identity, age or genetic information. Job Type: Contract Pay: $85,000.00 - $90,000.00 per year Benefits: Dental Insurance Health Insurance Paid Time Off Retirement Plan Vision Insurance Schedule: 8 Hour Shift Day shift Monday to Friday Experience: Windows Server Administration: 8 years (Required) Active Directory and GPO: 7 years (Required) VM WAre system administration: 5 years (Required) Education: Associate (Preferred) Contract Renewal: Likely Work Location: One location Company's website: www.vectortalent.com Benefit Conditions: Waiting period may apply Work Remotely: No",Windows System Administrator with Public Trust Level 2 Cleaerance,https://www.indeed.com/pagead/clk?mo=r&ad=-6NYlbfkN0CwDmAJad1vrFPjrCyZc1-12O19u5bGDYSMaAKB40LX6SgL_uQ_xlaLZoxDbDiymBSRNH7RPMoQwW0GV0vCW4olYzAuYPWvHkKJM9TUxEXXdDFS0vGlLmJ3red0movwVLjOwBjVsgWO34hrHYFJih3CtxuJUHwFIyUPdGMtHoNuxSVSm01A9Erwzmyu7Yzd3CoBCeS39qLFhOXfYkrKuvKyh0Wj5omauBerFBf9MoDZnarEXIOLWFSxa0OxU0VpmazVXzuajAIbh3U4vy0SCqN1yoDaTj9rxp8eKLPsY2uDf6h3DuuLoBbElgwHm1RcYSK_nw22ysj2goEVeaKxsQqhuSBuIoB-yExnLmu-yCtGjby0WfYmYiNLj856_ag9cygekThrIAdS83RRRD_6c6Yw3sUs0aypJi6lJG0GzWsEPVfgwAsmBmOrrjtev-FVA83HTb6bftLlcxdeh_kczws0I7Gn2xrnI0tichpVb-lr7JRXxH96qU1GTAvij2icWbuUqdELG1I6WQ==&p=3&fvj=1&vjs=3,3.0
4,YouTube,2020-07-30,"San Bruno, CA",Indeed,Trust Technology,"Minimum qualifications: Bachelor's degree or equivalent practical experience. Experience in content policy, anti-abuse or customer support operations, reviewing content and/or answering user questions, and working with vendors. Ability to work non-standard, on-call rotation work hours as needed. Preferred qualifications: Experience in driving large, cross-functional projects. SQL knowledge and interest in the intersection of policy, creator experience, and brand safety. Strong communication skills to drive consensus across stakeholders. Strong technical and analytical skills to frame solutions using data. Ability to create new processes and iterate on existing workflows. Ability to thrive in ambiguity. Fast-paced, dynamic, and proactive, YouTube’s Trust & Safety team is dedicated to making YouTube a safe place for users, viewers, and content creators around the world to belong, create, and express themselves. Whether understanding and solving their online content concerns, navigating within global legal frameworks, or writing and enforcing worldwide policy, the Trust & Safety team is on the frontlines of enhancing the YouTube experience, building internet safety, and protecting free speech in our ever-evolving digital world. As an Escalations Specialist on YouTube's Trust and Safety team, you will be responsible for managing complex and evolving incidents from end to end. You'll be involved in sensitive escalation management and will work closely with senior stakeholders across the business to ensure alignment in applying policy principles and addressing brand risk. You will be required to work cross-functionally across Policy Development, Policy Verticals, Scaled Abuse, Product, Infrastructure and Programs, and Global Scaled Operations to operationalize, enforce, and communicate policies that keep users safe and minimize brand risk to the platform. You'll be required to think through the unique challenges of a broad array of policy areas while developing workflows that are consistent and resilient. At YouTube, we believe that everyone deserves to have a voice, and that the world is a better place when we listen, share, and build community through our stories. We work together to give everyone the power to share their story, explore what they love, and connect with one another in the process. Working at the intersection of cutting-edge technology and boundless creativity, we move at the speed of culture with a shared goal to show people the world. We explore new ideas, solve real problems, and have fun — and we do it all together. Serve as Escalations Specialist for sensitive escalations, managing escalations from intake to execution to root cause resolution. Exercise strong business judgment through handling sensitive and complex escalations. Partner with local leadership to effectively communicate issues and their resolution. Engage with policy verticals and cross-functional stakeholders to drive large-scale changes based on key insights from managing incidents. Review graphic, controversial, and sometimes offensive video content in line with YouTube’s Community Guidelines.","Escalations Specialist, YouTube Trust and Safety",https://www.indeed.com/rc/clk?jk=152410f43f5579cc&fccid=a9021c35fcef6968&vjs=3,4.0
5,Phillips 66,2020-07-30,United States,Indeed,Trust Technology,Software Engineering Cloud Engineering Site Reliability Engineering Data Analytics & Engineering Digital Business Partner,2021 University Intern - Information Technology,https://www.indeed.com/rc/clk?jk=a92ddc2455863af3&fccid=72fa81f7018f6344&vjs=3,5.0
