,Company,Date_Queried,Location,Platform,Search_Term,Text,Title,URL,Unnamed: 0
56,Arris Composites,2020-07-30,"Berkeley, CA",Indeed,Equality Technology,"This is an experienced-level position in the manufacturing area. You will be responsible for the set up and operations of equipment, manufacturing of parts, and development of prototype processes with engineering support. Our R&D Advanced Composite Technicians facilitate the creation of new product capability, while meeting engineering specifications and quality requirements in accordance with Arris Composites' procedures. From a team that has been instrumental in the development of leading 3D printing and advanced manufacturing technologies comes the biggest development yet. At higher strength and lower density than titanium, carbon fiber composites hold the potential to change the world by unlocking novel design architectures that deliver unparalleled performance at lighter weights. Despite this potential, the complexity and cost of designing and manufacturing these anisotropic materials has limited their use to high-end, niche applications. Arris Composites has solved this problem and some of the top companies in the world have taken notice. New design latitude and improved performance provides competitive advantages for leaders across the industrial and consumer markets. Your view of composites is about to change.  Operate computer-controlled machines used in advanced composites manufacturing; check all controls for adherence to operating/safety procedures Examine materials and tooling both visually and physically to ensure conformance with established standards Use and maintain all required machines, tools, and work area cleaning Work with supervisors and engineers to establish production methods for new parts, while identifying any issues, problems or concerns in a timely manner Generate ideas for process improvement A high school diploma or equivalent Strong mechanical skills and prior work history, preferably in manufacturing (injection molding/compression molding/composites/tooling) Must be able to lift and/or move up to 40 pounds Knowledge and use of safety equipment as dictated by the work area, such as safety glasses, steel-toe shoes, respirator, face shield, hearing protection, gloves, etc. Excellent verbal and written communication skills Knowledge and understanding of composite materials (highly desired) Creative approach to solving mechanical problems Competitive salary with equity Comprehensive health, dental, vision, life insurance, long term disability Flexible Spending Account (FSA) & Dependent Care Flexible Spending Account (DCFSA) Pre-tax commuter benefits program Fantastic 401k matching plan Paid parental leave Generous vacation policy Healthy snacks, sparkling water, extremely addictive peanut butter pretzels This position is located in Berkeley, CA.It's within walking distance to Amtrak, ~1.5 miles from BART, and ~1 mile from the Marina Ferry (direct from SF Ferry Building).  Arris Composites recruits, employs, trains, compensates and promotes regardless of race, religion, color, national origin, sex, disability, age, veteran status, and other protected status as required by applicable law. At Arris Composites, we have a clear vision: to be the place where a diverse mix of talented people want to come and do their best work. We pride ourselves on providing best-in-class solutions to our customers around the world; our company runs on the hard work and dedication of our passionate and creative employees. Arris Composites' dedication to promoting diversity, multiculturalism, and inclusion is clearly reflected in our organization. Diversity is more than a commitment at Arris Composites—it is the foundation of what we do. We are fully focused on equality and believe deeply in diversity of race, gender, sexual orientation, religion, ethnicity, national origin and all the other fascinating characteristics that make us different. We maintain a policy of non-discrimination in providing equal employment to all qualified employees and candidates regardless of race, sex, sexual orientation, gender identity, age, color, religion, national origin, disability, genetic information, protected veteran's status, or other legally protected classification in the state or locality in which a person is employed.",R&D Advanced Composite Technician,https://www.indeed.com/rc/clk?jk=910ddc59fe860eea&fccid=661e12dd970f5ec7&vjs=3,56.0
57,Arris Composites,2020-07-30,"Berkeley, CA",Indeed,Equality Technology,"Arris Composites is seeking an experienced process engineer with four or more years of experience in manufacturing, process R&D, and/or mechanical/electrical testing. You are a problem solver with a knack for hands on trial-and-error experimentation, first principles analysis, and designing and building custom test setups. This role will enable various new product capabilities to a differentiated design portfolio. From a team that has been instrumental in the development of leading 3D printing and advanced manufacturing technologies comes the biggest development yet. At higher strength and lower density than titanium, carbon fiber composites hold the potential to change the world by unlocking novel design architectures that deliver unparalleled performance at lighter weights. Despite this potential, the complexity and cost of designing and manufacturing these anisotropic materials has limited their use to high-end, niche applications. Arris Composites has solved this problem and some of the top companies in the world have taken notice. New design latitude and improved performance provides competitive advantages for leaders across the industrial and consumer markets. Your view of composites is about to change.  Design, prototype and improve novel manufacturing processes Work with hands-on experimental production and testing of new product capabilities by assessing both mechanical and electrical performance criteria Work collaboratively with technical and non-technical colleagues to effectively and safely produce parts for testing Estimate technical risk to complete tasks, and establish and communicate development timelines across teams Quantify part performance via statistical analysis, and consult on implementation into production applications Minimum of a BS in Mechanical, Electrical, or Chemical Engineering, MS preferred 4+ years manufacturing experience, ideally in an R&D or process development setting Mechanical/electrical design and hands-on prototyping experience The ability to draw confident and meaningful conclusions from rapid prototyping A thorough understanding of design of experiments and statistical analysis tools Excellent attention to detail and thorough documentation practices Good written and verbal communication skills; You are very capable of communicating effectively with cross disciplinary experts to achieve interdependent objectives Competitive salary with equity Comprehensive health, dental, vision, life insurance, long term disability Flexible Spending Account (FSA) & Dependent Care Flexible Spending Account (DCFSA) Pre-tax commuter benefits program Fantastic 401k matching plan Paid parental leave Generous vacation policy Healthy snacks, sparkling water, extremely addictive peanut butter pretzels This position is in Berkeley, CA. It's within walking distance to Amtrak, ~1.5 miles from BART, and ~ 1 mile from the Marina Ferry (direct from SF Ferry Building) Arris Composites recruits, employs, trains, compensates and promotes regardless of race, religion, color, national origin, sex, disability, age, veteran status, and other protected status as required by applicable law. At Arris Composites, we have a clear vision: to be the place where a diverse mix of talented people want to come and do their best work. We pride ourselves on providing best-in-class solutions to our customers around the world; our company runs on the hard work and dedication of our passionate and creative employees. Arris Composites' dedication to promoting diversity, multiculturalism, and inclusion is clearly reflected in our organization. Diversity is more than a commitment at Arris Composites—it is the foundation of what we do. We are fully focused on equality and believe deeply in diversity of race, gender, sexual orientation, religion, ethnicity, national origin and all the other fascinating characteristics that make us different. We maintain a policy of non-discrimination in providing equal employment to all qualified employees and candidates regardless of race, sex, sexual orientation, gender identity, age, color, religion, national origin, disability, genetic information, protected veteran's status, or other legally protected classification in the state or locality in which a person is employed.",R&D Process Engineer,https://www.indeed.com/rc/clk?jk=1d4a5561dea95770&fccid=661e12dd970f5ec7&vjs=3,57.0
58,Edward Jones,2020-07-30,"Scotts Valley, CA",Indeed,Equality Technology,"If you find yourself looking for a fulfilling career, the Branch Office Administrator (BOA) role may be the right opportunity for you. BOAs team up with financial advisors to help clients achieve their long-term financial goals. We’re proud to have more offices in the U.S. and Canada than any other investment firm, serving over seven million clients.Our Branch Office Administrators are a valued part of the client team, and we credit much of our success to their unique experiences and professional backgrounds. We value different viewpoints to help achieve results. We don’t often brag, but we’re frequently recognized and awarded as a top place to work. Some of the many accolades include 100 Best Companies to Work For®” by FORTUNE magazine1 and a Best Place to Work for LGBT Equality by the Human Rights Campaign. We'll give you the support you need. Our team will be there every step of the way, providing: Comprehensive 6 month training including an experienced peer mentor A network that extends from your branch office to your region to the home office  You can also expect… A compensation package that includes bonus potential, profit sharing, 401k and comprehensive and competitive health benefits Paid time off including vacation, sick, holidays and personal days A culture of continuous improvement and professional development Position Requirements What characteristics would make you a successful BOA? Ability to deepen and broaden client relationships Comfortable in your ability to identify opportunities to create efficiency Strong ability to work independently Ability to manage multiple priorities in a deadline driven environment Proficient in current and new office technology Willingness to learn how financial services/markets work ","Branch Office Administrator- Scotts Valley, CA",https://www.indeed.com/rc/clk?jk=807054e93da18168&fccid=427252222cb23e7e&vjs=3,58.0
59,Pearson,2020-07-30,"Sacramento, CA",Indeed,Inclusion Technology," Description At Pearson, we’re committed to a world that’s always learning and to our talented team who makes it all possible. From bringing lectures vividly to life to turning textbooks into laptop lessons, we are always re-examining the way people learn best, whether it’s one child in our own backyard or an education community across the globe. We are bold thinkers and standout innovators who motivate each other to explore new frontiers in an environment that supports and inspires us to always be better. By pushing the boundaries of technology — and each other to surpass these boundaries — we create seeds of learning that become the catalyst for the world’s innovations, personal and global, large and small. The Composition Quality Assurance Administrator reviews and checks every aspect of the student test book (i.e., item creation, book formatting, online functionality, etc). The Composition QA Admin will be trained by team leads and guided to work on designated state projects. The position is a mix of group work as well as independent tasks. The Composition QA will also work on paper test books by verifying printing requirements, and online test books by checking item functionality, form navigation, and tool inclusion. Responsibilities: Perform checks digitally for items, test books, manuals and answer sheets during different stages of their development by the Publishing Services team and mark revisions as necessary. Check technical marks and critical copy on scannable (machine-read) forms (ex. timing tracks, QIMs, skunks) to ensure that tests can be scanned. Maintain the correctness and completeness of text, artwork and items in all documents for both paper and online testing as documented. Verify item order in paper test books and that book formatting is accurate per state standard requirements. Verify requested edits are accurately applied. Validate specifications against online published books, check online system navigation tools, test Technically Enhanced Item (TEI) functionality, review and research production/quality issues. Interact with Publishing Project Manager, Implementation Manager, Technical Composition Production Specialists, Asset Production Specialists, Composition Production Specialists and Graphic Artists in the Publishing Services department daily, as well as Program Team and others as needed. Work overtime, as needed, to meet tight schedules for printing, online delivery and testing deadlines. Some months will be much heavier than others. Overtime can occur for both the evenings and the weekends. Qualifications Qualifications Strong command of technical aptitude. Must be detail oriented and organized. Must be able to multi-task and work well in a team environment. Ability to communicate, in writing, neatly and effectively. Knowledge of layout and design principles preferred. Experience on both MAC and PC computers. Adobe Acrobat Professional desirable. Quark and Adobe Creative Suite knowledge desirable. Bachelor’s degree or equivalent preferred. Please note this is an onsite temporary (non-benefits eligible) role with projected duration through January. Must be local to Iowa City, Cedar Rapids, IA areas and/or Owatonna, MN. Work Schedule: Monday thru Friday 8-5 with OT opportunity Remote Work Pearson is an Equal Opportunity and Affirmative Action Employer and a member of E-Verify. All qualified applicants, including minorities, women, protected veterans, and individuals with disabilities are encouraged to apply. Primary Location: US-RE-Remote Other Locations US-IA-Cedar Rapids, US-IA-Iowa City, US-MN-Owatonna Work Locations: US-Remote Remote Job: Technology Organization: Assessments School Employee Status: Fixed Term Job Type: Standard Shift: Day Job Job Posting: Jul 29, 2020 Job Unposting: Ongoing Schedule: Full-time Temporary Req ID: 2007335 Pearson is an Equal Opportunity and Affirmative Action Employer and a member of E-Verify. All qualified applicants, including minorities, women, protected veterans, and individuals with disabilities are encouraged to apply.","Composition Quality Assurance Administrator, Temporary",https://www.indeed.com/rc/clk?jk=352b5f015711cd5b&fccid=915b1c0ee87e5e8a&vjs=3,59.0
60,Better Mortgage Corporation,2020-07-30,"Oakland, CA",Indeed,Inclusion Technology,"Better is redefining homeownership and making it simpler, faster—and most importantly—more accessible for everyone. We leverage technology and expertise to find ways that we can make the homebuying journey more approachable and understandable. Right now we’re funding $1 billion in home loans per month We’ve funded over $9 billion in loans and $1 billion in insurance We ranked #11 on Fortune’s Best Places to Work in Financial Services 2020 Our Founder and CEO was named in Comparably's Top 25 CEOs for Diversity We were listed to Forbes’ FinTech 50 2020 And #964 on Inc.’s 2019 “5000 Fastest-Growing Companies” We’ve secured over $254 million from our investors to date Our company is made up of driven, passionate people who bring their unique backgrounds and perspectives to everything we do and we are committed to fostering diversity, multiculturalism, and inclusion. We see the perspectives that each person brings and a diverse workforce as essential for individual and collective success. We believe it’s important to foster a company culture that encourages curiosity and passion—from employee resource groups and learning opportunities to team outings and community outreach. A Better Opportunity: Better is looking for a Team Lead, IT Support to lead & support our regional IT Support teams. This person will report to and work strategically with the IT Support Manager and Global Head of IT to ensure efficient support for our end users, and to complete related projects. The ideal candidate is a customer-service driven, technical person who can manage day-to-day operations and provide tech support to end users across the organization as well as to the IT Support team. This person should be comfortable multi-tasking, able to maintain high attention to detail, and be resourceful as needed. Responsibilities will include: Facilitate IT Support projects Ensure timely work completion and SLA adherence Supervise daily workflow of the IT Support team Triage escalations from the Support team for resolution Manage all customer escalations Manage inter-departmental escalations Ensure best IT best practices are followed Enforce best practices of IT & Security Ensure proper documentation for frequently asked questions Asset management and procurement of IT equipment Manage IT asset tracking Ensure all IT processes are properly documented and updated as needed Ensure all IT processes are being followed Provide guidance to members of the support Enforce adherence to defined SLAs Provide daily and regular feedback to IT management on team stats Provide daily and regular reporting and trends to IT management Manage team schedules and shifts for proper coverage About You: 5 - 10 Years Experience in IT Support and Service Desk 2 - 3 Years minimum leadership experience Customer Service experience Familiar with Active Directory Familiar with macOS Understands basic networking (Experience with VLANs, Subnets, Firewalls) Preference for those who have worked in companies that require compliance Able to write and maintain documentation Well versed with Help Desk ticketing systems Preference for those who have worked with global IT teams in the past Have a passion for serving and helping people Flexible in managing up and down The Better mission is rooted in values that drive us. We do what’s in the best interest of the consumer, not ourselves We have growth mindsets, not fixed ones We believe that success lies in execution, not credentials We act like owners, not just employees We work to find answers on our own, not wait for them to be given to us We optimize for mission, not ego Our mission speaks for itself—we continue to outpace the industry at every turn. We’ve recently joined forces in partnership with Ally Bank, and our backers have helped build some of the most transformative tech and finance companies in history. Kleiner Perkins, Goldman Sachs, American Express, Citigroup, Activant Capital, Ally Bank, and others have invested in our vision for what homeownership can be. Better is an equal opportunity employer. We do not discriminate on the basis of race, color, religion or religious creed, sexual orientation, gender, gender identity, marital status, family or parental status, disability, military or veteran status, or any other basis protected by law. All employment decisions at Better are based on a person’s merit, business needs, and role requirements.",Team Lead,https://www.indeed.com/rc/clk?jk=c422bb453796400a&fccid=38428bc0dc4a9166&vjs=3,60.0
61,Mercy For Animals,2020-07-30,California,Indeed,Inclusion Technology,"Remote in the United States Mercy For Animals, a leading global nonprofit working to end the exploitation of animals for food and construct a compassionate food system, seeks a U.S. board member with animal advocacy experience, committed to anti-racism, diversity, equity, and inclusion. Mercy For Animals' U.S. board of directors is a volunteer board. Members are not paid and dedicate their time and expertise to support Mercy For Animals and its mission. As a member of Mercy For Animals' U.S. board, you will do crucial work: Provide guidance and support that promote the organization's mission of animal protection and anti-oppression objectives Support the president in setting strategy, ensuring progress, and advancing the mission and vision of the organization Ensure productive, inclusive, and equitable governance by reviewing our programs, overseeing risk management, advising senior team members, and reviewing and approving budgets Serve as an advocate of our mission We are looking for mission-aligned professionals: A proven leader with high emotional intelligence, strong collaboration skills, solid strategic planning experience, a demonstrated commitment to DEI, and expertise in one or more of the following areas: Advocacy Community building for historically marginalized communities Corporate strategy Environmental justice Finance Food justice Fundraising Grassroots activism Human resources Legislation Media Nonprofit management Racial justice Technology In serving, you are willing to do the following: Commit to a three-year term and active participation on the board Integrate DEI and anti-racism into animal protection in line with Mercy For Animals' mission and objectives Challenge the status quo and provide expert guidance in collaboration with other board members Attend four board meetings each year (two in-person meetings if possible, with virtual attendance also supported); key Mercy For Animals events, including the gala; consultations in special advisory roles; and calls as needed Our Commitment to Diversity and Inclusion We know that to achieve our goals and realize our vision, we need diverse perspectives, drawn from a wide range of backgrounds, that help us ask the right questions and avoid groupthink. We are publicly recruiting for board positions to ensure we move beyond our immediate network and honor our ongoing commitment to inclusion and diverse perspectives to create an equitable board. We encourage candidates from historically marginalized communities (e.g., Black, indigenous, and people of color; people with disabilities) and those running nonprofits to apply.",Board Member,https://www.indeed.com/rc/clk?jk=23419f0f9db76d2d&fccid=9bde96dfa0178606&vjs=3,61.0
